{
 "registry": "humanizer-ru facts: публичные числа витрины (единственный источник)",
 "schema": "facts.schema.v1.json",
 "updated": "2026-09-08",
 "entries": [
  {
   "fact_id": "fp-zero-snap-2026-08-25",
   "claim": "ноль ложных обвинений на 11 человеческих текстах: датированный снимок прогона 2026-08-25, а не свойство детектора",
   "status": "limited",
   "publication_approved": true,
   "tokens": [
    "0/11"
   ],
   "value_note": "0/11, Wilson 95% CI [0%; 25.9%]",
   "artifact": "eval/detect-results/2026-08-25-detect-axis-12-glm53.json",
   "reproduce": "python3 scripts/check_confidence.py --check",
   "reproduce_public": true,
   "date": "2026-08-25",
   "note": "без даты ни одна величина не цитируется (ERRATA.md)"
  },
  {
   "fact_id": "fp-zero-snap-2026-09-03",
   "claim": "ноль ложных срабатываний regex-слоя на 26 человеческих текстах: датированный снимок парного прогона 2026-09-03 на корпусе полного дерева, а не свойство детектора",
   "status": "limited",
   "publication_approved": true,
   "tokens": [
    "0/26"
   ],
   "value_note": "0/26, Wilson 95% CI [0%; 12.9%]; корпус: 26 человеческих текстов, 24 машинных ответа 7 семейств, 2 boundary-контроля (eval/manifest.v1.json, все с sha256)",
   "artifact": "research/leaderboard/reference-2026-09-03.json, research/leaderboard/smixs-2026-09-03.json, eval/manifest.v1.json",
   "reproduce": "python3 eval/run_eval.py && python3 scripts/check_confidence.py --check",
   "reproduce_public": true,
   "date": "2026-09-03",
   "note": "парный прогон одной даты с smixs/humanizer-ru (пин 91f70df); формализация предрегистрации когорты — research/leaderboard/cohort-prereg-2026-09-03.md (честная нота о порядке замера и формализации обязательна к цитированию); без даты величина не цитируется (ERRATA.md)",
   "assumptions": [
    "prereg-frozen"
   ]
  },
  {
   "fact_id": "di-control-2026-09",
   "claim": "положительный контроль Di не пройден: читательская панель из трёх семейств LLM не отличает сырой машинный текст от согласованного человеческого (две семьи — системная инверсия 0/18); различение Di главного прогона не интерпретируется",
   "status": "limited",
   "publication_approved": false,
   "tokens": [
    "0.444",
    "0.000",
    "8/18",
    "0/18",
    "0.246",
    "0.663",
    "0.176"
   ],
   "value_note": "qwen 0.444 (8/18, CI [0.246; 0.663]); deepseek 0.000 (0/18, CI [0.000; 0.176]); kimi 0.000 (0/18, CI [0.000; 0.176]); агрегат 0/18; вердикт FAIL; следствие — заявка C-класса",
   "artifact": "research/DI-CONTROL-2026-09.md",
   "reproduce": "python3 scripts/di_control_analyze.py",
   "source_data": [
    "research/di-control-2026-09/results-qwen.json (sha256 7d374522239612887eba9f5301eba4470051b3edb8168b8621925e6faa8a5fea)",
    "research/di-control-2026-09/results-deepseek.json (sha256 87f908d7db2027da424e5c333a763946e0bad213105f21d2254acd40757cbeb8)",
    "research/di-control-2026-09/results-kimi.json (sha256 3807c52a3b24a068f0e47beb830aa3c2aa552cb68a28f407f05512bee32717f4)",
    "run:measurement/di-control-2026-09/sides.json (sha256 28f9c398733e9830f9a167eeaa3b5d91c5477dc28472b86cb8d15ac4fafbb279)"
   ],
   "date": "2026-09-03",
   "note": "предрег research/di-control-2026-09/prereg.md заморожен до первого сужения (RUNLOG W-76, штамп research/prereg-stamps/MANIFEST.md); гриф «судьи LLM, до человеческого контроля»; конфлейт «человечность ↔ аккуратность» — гипотеза, не замер. 2026-09-06: публикация чисел приостановлена (publication_approved=false) — цепочка воспроизведения неисполнима из публичных данных: анализатору нужен каталог приватного прогона (sides.json, хеш зафиксирован в research/di-control-2026-09/PRIVATE-ARTIFACTS.md); прежняя команда воспроизведения вела на несуществующий путь tools/di_control_analyze.py, исправлена на фактический scripts/di_control_analyze.py; исторический отчёт и сырые суждения трёх семейств сохранены, эррата — ERRATA.md",
   "assumptions": [
    "llm-judge-oracle",
    "prereg-frozen",
    "private-run-artifact"
   ]
  },
  {
   "fact_id": "fp-repl-2026-08-31",
   "claim": "реплика той же линии судьи 2026-08-31: два человеческих текста из 11 превысили порог обвинения",
   "status": "limited",
   "publication_approved": false,
   "tokens": [
    "2/11"
   ],
   "value_note": "2/11, Wilson 95% CI [5.1%; 47.7%]",
   "artifact": "run:w1-gates/w1-decomposition.json (прогон run-20260831)",
   "date": "2026-08-31",
   "note": "обе поверхности датированы; ни одна не даёт права писать «FP = 0» без даты; артефакт приватного прогона, публикация данных — после лицензионного и privacy-гейта",
   "assumptions": [
    "single-family-panel",
    "private-run-artifact"
   ]
  },
  {
   "fact_id": "fp-repl-scores-2026-08-31",
   "claim": "скоры двух человеческих текстов в реплике 2026-08-31 выше порога 0.5",
   "status": "limited",
   "publication_approved": false,
   "tokens": [
    "0.65"
   ],
   "value_note": "два скора 0.65 при пороге обвинения 0.5",
   "artifact": "run:w1-gates/w1-decomposition.json (прогон run-20260831)",
   "date": "2026-08-31",
   "note": "артефакт приватного прогона, публикация данных — после лицензионного и privacy-гейта",
   "assumptions": [
    "single-family-panel",
    "private-run-artifact"
   ]
  },
  {
   "fact_id": "detect-overlap-ours-2026-08-12",
   "claim": "совпадения regex-слоя классов A/B на нейтральном корпусе 2026-08-12: человеческие тексты и boundary-контроли",
   "status": "limited",
   "publication_approved": true,
   "tokens": [
    "0/11",
    "2/2"
   ],
   "value_note": "0 совпадений на 11 человеческих текстах (Wilson 95% CI [0%; 25.9%]); 2/2 boundary-контроля",
   "artifact": "research/leaderboard/*.json, eval/manifest.v1.json",
   "reproduce": "python3 eval/run_eval.py",
   "reproduce_public": true,
   "date": "2026-08-12"
  },
  {
   "fact_id": "detect-overlap-smixs-2026-08-12",
   "claim": "снимок третьей стороны: smixs/humanizer-ru на том же нейтральном корпусе",
   "status": "limited",
   "publication_approved": true,
   "tokens": [
    "1/2"
   ],
   "value_note": "1/2 boundary-контролей (остальные ячейки строки — целые счётчики)",
   "artifact": "research/leaderboard/*.json",
   "date": "2026-08-12",
   "note": "коммит 91f70df11f7fb30722e6fcf18803d402e2d86a53 (2026-08-05), MIT; числа столбца не сравнимы между кандидатами"
  },
  {
   "fact_id": "axis-delta-llmrubric-2026-08-25",
   "claim": "дельта детектируемости до/после (llm_rubric) — интерпретация как показателя качества после переписывания ОТОЗВАНА",
   "status": "withdrawn",
   "publication_approved": true,
   "tokens": [
    "0.846",
    "0.438",
    "0.408",
    "11/12"
   ],
   "value_note": "скор raw 0.846 → после 0.438; дельта −0.408; 11/12 пар ниже; ячейка FP этой строки — отдельная запись (0/11)",
   "artifact": "eval/detect-results/2026-08-25-detect-axis-12-glm53.json",
   "reproduce": "python3 eval/reproduce.py",
   "reproduce_public": true,
   "retraction": "ERRATA.md (2026-09-01), research/AXIS-RUBRIC-RETRACTION-2026-09-01.md",
   "date": "2026-08-25",
   "note": "число воспроизводится; эффект даёт срез формата и обвязки (3/3 семьи), а не смысловая перезапись (0/3)"
  },
  {
   "fact_id": "axis-delta-ttr-2026-08-25",
   "claim": "дельта stdlib-прокси лексического разнообразия (ttr_lexdiv) — относительная метрика одной даты, не вердикт",
   "status": "limited",
   "publication_approved": true,
   "tokens": [
    "0.414",
    "0.309",
    "0.105",
    "6/9"
   ],
   "value_note": "скор raw 0.414 → после 0.309; дельта −0.105; 6/9 валидных пар ниже (3 пары короче 20 токенов — guard None)",
   "artifact": "eval/detect-results/2026-08-25-detect-axis-12-ttr.json",
   "reproduce": "python3 eval/reproduce.py --report eval/detect-results/2026-08-25-detect-axis-12-ttr.json",
   "reproduce_public": true,
   "date": "2026-08-25",
   "note": "якоря — эвристика уровня O; регрессии на 3 парах задокументированы в JSON"
  },
  {
   "fact_id": "axis-noise-ttr-2026-08-25",
   "claim": "шум ttr_lexdiv на человеческих текстах: максимум ниже порога",
   "status": "limited",
   "publication_approved": true,
   "tokens": [
    "0.411"
   ],
   "value_note": "максимальный скор 0.411 (it-notation) при пороге 0.5",
   "artifact": "eval/detect-results/2026-08-25-detect-axis-12-ttr.json",
   "date": "2026-08-25"
  },
  {
   "fact_id": "panel-precedent-g5-2026-08-28",
   "claim": "прецедент двухсемейной репликации слепой панели (норма 2026-08-28): G5, согласие семей",
   "status": "limited",
   "publication_approved": true,
   "tokens": [
    "14/14"
   ],
   "value_note": "Qwen3.7-max и GLM-5.2 дали одинаковый вердикт 14/14 (p=0.000122)",
   "artifact": "research/agent/G5-exp1-report.md, research/superposition/2026-08-28-q4-judge-panel/",
   "date": "2026-08-28",
   "note": "панельные числа — со статусом и оговоркой о позиционном шуме; механические оси второй семьи не требуют"
  },
  {
   "fact_id": "softlayer-realistic-corpus-2026-09-01",
   "claim": "мягкий слой на реалистичном корпусе: рабочей точки «FP=0 при ненулевом recall» не существует; прежняя заявка «62.5% при FP=0» отозвана",
   "status": "withdrawn",
   "publication_approved": true,
   "tokens": [
    "0.211",
    "0.140",
    "0.306",
    "0.491",
    "0.445",
    "0.538"
   ],
   "value_note": "T=1/K=1: recall 0.211 [0.140; 0.306] при доле ложных обвинений 0.491 [0.445; 0.538]; корпус: 90 машинных против 440 человеческих",
   "artifact": "run:experiments/w3-threshold.json (прогон run-20260831)",
   "retraction": "ERRATA.md (2026-09-01), статус-баннеры research/F5-* и research/soft-threshold-sweep/",
   "date": "2026-09-01",
   "note": "отозванное число 62.5% в витринных текстах не встречается; здесь — честный замер на реалистичном корпусе; артефакт приватного прогона, публикация данных — после лицензионного и privacy-гейта",
   "assumptions": [
    "private-run-artifact"
   ]
  },
  {
   "fact_id": "flagship-signtest-2026-08-25",
   "claim": "знак-тест флагманской дельты — принадлежит отозванной интерпретации",
   "status": "withdrawn",
   "publication_approved": true,